Comments,Cleaned_Comments,Translated_Comments
"Special offer 25% Off. Use Code &#39;EDUTT&#39; - <a href=""https://eduquest.courses/"">https://EduQuest.courses</a><br>Digital Marketing, Stock Market Courses from Experts. Call 8113 8113 95",special offer off use code edutt a href marketing stock market courses from experts call,special offer off use code edutt a href marketing stock market courses from experts call
Best Review,best review,best review
1 2 ethum paakala ЁЯШЕЁЯШЕ,ethum paakala,Ethum Paakala
"this reviewer made a film and it was a big flop, still he is confidently talking about mitakes or shortcomings of other movies/film nakers",this reviewer made a film and it was a big flop still he is confidently talking about mitakes or shortcomings of other moviesfilm nakers,this reviewer made a film and it was a big flop still he is confidently talking about mitakes or shortcomings of other moviesfilm nakers
"Straight ah Netflix la pushpa 2 pathutu varen, biryani saptu dessert sapdala na epdi ЁЯШВ thoroughly enjoyed the movie (stress buster )and laughed out loud seeing your review ЁЯШВЁЯШВ",straight ah netflix la pushpa pathutu varen biryani saptu dessert sapdala na epdi thoroughly enjoyed the movie stress buster and laughed out loud seeing your review,straight ah netflix la pushpa pathutu varen biryani saptu dessert sapdala na epdi thoroughly enjoyed the movie stress buster and laughed out loud seeing your review
"Yow nejamaave nalla padamya.... Just watched in Netflix.. Telugu cinema is doing 1700 crores, neenga tamil movie ellathayum  criticize panni padatha saavadichutu... Tamil cinema va naasam pannadeenga...",yow nejamaave nalla padamya just watched in netflix telugu cinema is doing crores neenga tamil movie ellathayum criticize panni padatha saavadichutu tamil cinema va naasam pannadeenga,Yow Nejamave Nalla Padamya Just Watched in Netflix Telugu Cinema Is Doing Crores Nivea Tamil Movie Ellathayum Criticize Padatha Saavadichutu Tamil Cinema Vaasasa Vaasasa Vaasasa Vaasena
родро┐ро░рпБроЯрпНроЯрпБ родро┐ро░ро╛ро╡ро┐роЯ рокрпБродрпНродро┐ роХро╛роЯрпНроЯро┐роЯрпНроЯ.....роЗродрпЗ рокроЯродрпНродрпИ родрооро┐ро┤рпН роЯрпИро░роХрпНроЯро░рпН роОроЯрпБродрпНродрпБ родрооро┐ро┤рпН роироЯро┐роХро░рпН роироЯро┐родрпНродрпБ роЗро░рпБроирпНрод роирпА роЗродрпБ рооро╛ро▒ро┐ рокрпЗроЪрооро╛роЯрпНроЯро╛....роХрпЗро╡ро▓рооро╛ рокрпЗроЪрпБро╡ роирпА родрооро┐ро┤ройро╛роХ роЗро░рпБроХрпНроХ рооро╛роЯрпНроЯ,родро░роЯроЯ родро░ро╡роЯ рокродрод роХроЯроЯроЯроЯроЗрод рокроЯродрод родрооро┤ роЯро░роХроЯро░ роОроЯродрод родрооро┤ роироЯроХро░ роироЯродрод роЗро░роирод рои роЗрод рооро▒ рокроЪроороЯроЯроХро╡ро▓роо рокроЪро╡ рои родрооро┤ройроХ роЗро░роХроХ роороЯроЯ,"This is the quality of the quality of the quality of the film, which is the best way to do this."
Pushpa 2 success is the worst day of Indian film history. Indian peoples standards have gone so low that they prefer movies like this!,pushpa success is the worst day of indian film history indian peoples standards have gone so low that they prefer movies like this,pushpa success is the worst day of indian film history indian peoples standards have gone so low that they prefer movies like this
Reloaded Version gives explanation on netflix. Looks like its a CUT for 20 minutes,reloaded version gives explanation on netflix looks like its a cut for minutes,reloaded version gives explanation on netflix looks like its a cut for minutes
U people are stomach burning assholes make the film like that and show ЁЯШВЁЯШВЁЯШВmingaleka mangalavaram antaru ЁЯШВЁЯШВЁЯШВ,u people are stomach burning assholes make the film like that and show mingaleka mangalavaram antaru,u people are stomach burning assholes make the film like that and show mingaleka mangalavaram antaru
Palaiya parthipan padamathiri irrukku,palaiya parthipan padamathiri irrukku,Palaiya PARTHIPAN PADAMATIRI IRRUKKU
ЁЯСМ,,
Now see ott version <br>Answer yr question,now see ott version branswer yr question,now see ott version branswer yr question
This is What we know that how tamil industry falldown... As we know that pushpa 2 got 1800+cr we have to receive the content not masala ok...,this is what we know that how tamil industry falldown as we know that pushpa got cr we have to receive the content not masala ok,this is what we know that how tamil industry falldown as we know that pushpa got cr we have to receive the content not masala ok
рокроЯроорпН роиро▓рпНро▓ро╛ роЗро░рпБроХрпНроХрпБ,рокроЯроо роиро▓ро▓ роЗро░роХроХ,Immigration variety
рокро╖рпНрокро╛2;  The rule super hit movie. World record...in collection.,рокро╖рок the rule super hit movie world recordin collection,рокро╖рок the rule super hit movie world recordin collection
роЕроЯрпЗропрпН( роЬрокрпНрокро╛ройрпН )роЕродрпБ роХройро╡рпБ роЪрпАройрпН роЯро╛ рокрпЗрокрпНрокропро▓рпЗ,роЕроЯроп роЬрокрокрой роЕрод роХройро╡ роЪрой роЯ рокрокрокропро▓,Adya Japana is a dream.
Hello pombala vesham nu sollure avanga kaali amman vedham puridha kaali amman ЁЯЩП yaruya nee theliva pesu ya <br>Vaaiku vandhade pesura,hello pombala vesham nu sollure avanga kaali amman vedham puridha kaali amman yaruya nee theliva pesu ya brvaaiku vandhade pesura,Hello pombala vesham nu Sollure Avanta Kaali Amman Vedham Puridha Kaali Kaali Amman Yaruya Nee Theliva Laundry Ya Brvaaiku Vandhade Washinga
First Japan fight and falling into sea is a nightmare dream scream for allu Arjun I think,first japan fight and falling into sea is a nightmare dream scream for allu arjun i think,first japan fight and falling into sea is a nightmare dream scream for allu arjun i think
"Oru padathuku edu climax nu neanga yen sir decide pandringa , starting la Vera villan ending la Vera villan , ungaluku oru opinion irunda ada neanga vachi konga , ivalo kora soldringa , neanga oru padam hero va nadichi paarunga , inda ulagame ungala evalo kaluvi oothudunu appa theriyum , nadippe varala idula nadikiravangaka kora solli kaasu sambarikka alairia neanga ellam , manisha janmangala",oru padathuku edu climax nu neanga yen sir decide pandringa starting la vera villan ending la vera villan ungaluku oru opinion irunda ada neanga vachi konga ivalo kora soldringa neanga oru padam hero va nadichi paarunga inda ulagame ungala evalo kaluvi oothudunu appa theriyum nadippe varala idula nadikiravangaka kora solli kaasu sambarikka alairia neanga ellam manisha janmangala,"ORU, Edu Climax Nu Neanga Yen Sir Sir Decide Pandringa Starting La Vera Villan La Vera Villan Ungaluku Oru Irunda Irunda There is Neanga Vachi Konga Ivalo Kora Soldringa Neanga ORU ORU OURI VA VA Nadichi Theriyum Nadippe Varala Idula Nadikiravangaka Koranu Kaasu Sambarikka Alairia Neanga Ellam Manisha Janmangala"
Kaji pidicha padam,kaji pidicha padam,Kaji Pidam Padam
The most hatred film .,the most hatred film,the most hatred film
рокрпБро╖рпНрокро╛ рокрпБро░рпБро╖ройрпНЁЯдЧ,рокро╖рок рокро░ро╖рой,Pashabha Parashana
What ever telugu masala movie... crossed 2000 cr,what ever telugu masala movie crossed cr,what ever telugu masala movie crossed cr
рокроЯроорпН рокро╛ро░рпНродрпНрод depression роЕ роЙроЩрпНроХро│рпН review рокро╛ро░рпНродрпНродрпБ роЪро┐ро░ро┐родрпНродрпБ роХрпБро▒рпИродрпНродрпЗройрпН ЁЯШВЁЯШВЁЯШВЁЯШВ,рокроЯроо рокро░родрод depression роЕ роЙроЩроХро│ review рокро░родрод роЪро░родрод роХро▒родродрой,Image Paradise Depression Your Review
ЁЯША,,
Pushpa puruse highlight ЁЯШВ,pushpa puruse highlight,pushpa puruse highlight
Evn oru lus kut.. Adikdi nirbkran. рокрпКро▒ро╛роорпИ pdu.. Tis is sper hero stry da naaaaaaya,evn oru lus kut adikdi nirbkran рокро▒роо pdu tis is sper hero stry da naaaaaaya,EVN ORU LUS KUPI NIRBKRAN рокро▒роо PDU TIS IS SPER HERO STRY DA NAAAAAAAA
"I&#39;m a Telugu person, I support this review.....Sukumar is a over rated director.....and so is this film...!!!",im a telugu person i support this reviewsukumar is a over rated directorand so is this film,im a telugu person i support this reviewsukumar is a over rated directorand so is this film
"This movie is special for MILK POURING ON POSTER boys and girls , not for people who have even a bit of human intellect",this movie is special for milk pouring on poster boys and girls not for people who have even a bit of human intellect,this movie is special for milk pouring on poster boys and girls not for people who have even a bit of human intellect
"<a href=""https://www.youtube.com/watch?v=MDeOZdbSBCU&amp;t=385"">6:25</a> to <a href=""https://www.youtube.com/watch?v=MDeOZdbSBCU&amp;t=416"">6:56</a> ЁЯШВЁЯШВЁЯШВ Yo Semma Nakkal ya unnakku",a href to a href yo semma nakkal ya unnakku,a href to a href yo semma nakkal of unnakku
Romba telugu padama irukkumЁЯШВЁЯШВ,romba telugu padama irukkum,Romba telugu in irkkum
Telugu movienave karuthu illatha moviethan,telugu movienave karuthu illatha moviethan,TElu Movienave Karuthu Illatha Moviethan
Pushpa роорпКроХрпНроХрпИ don&#39;t waste your value money,pushpa роороХроХ dont waste your value money,pushpa роороХроХ dont waste your value money
Ivanukk cash kidaikuthu athan intha mathiri review,ivanukk cash kidaikuthu athan intha mathiri review,ivanukk cash kidaikuthu athan intha mathiri review
First scene is lead of next part pushpa 3,first scene is lead of next part pushpa,first scene is lead of next part pushpa
Target 1000 cr AchievedЁЯШВЁЯШВЁЯШВ Kadharunga da,target cr achieved kadharunga da,Target cr Achieved Kadhanga da
"Pushpa, not flower, Bakwaas ЁЯШЕЁЯШВЁЯдг",pushpa not flower bakwaas,pushpa not flower bakwaas
роЬрокрпНрокро╛ройрпНроХро╛ро░ройрпН родрооро┐ро┤рпН ро▓ рокрпЗроЪрпБро▒ро╛ройрпН ро╣рпАро░рпЛ роЬрпЖрокройро┐ро╖рпН ро▓ рокрпЗроЪрпБро▒ро╛ройрпН роиро▓рпНро▓ роХро╛роорпЖроЯро┐ ЁЯШБЁЯШБЁЯШБ,роЬрокрокройроХро░рой родрооро┤ ро▓ рокроЪро▒рой ро╣ро░ роЬрокройро╖ ро▓ рокроЪро▒рой роиро▓ро▓ роХроороЯ,Japanagarana Tamil
Pushpa 2 is good movie not bad compared to recent movies ЁЯШВЁЯШВ,pushpa is good movie not bad compared to recent movies,pushpa is good movie not bad compared to recent movies
Iniku than pushpa2 parthen..japanese sequence seems dream.not real..,iniku than pushpa parthenjapanese sequence seems dreamnot real,iniku than pushpa parthenjapanese sequence seems dreamnot real
"I watch Pushpa 1 only 15 mins &amp; was wondering what&#39;s the craze? Only those with low IQ will enjoy such a idiotic movie, I&#39;m shocked got Pushpa 2. I hope people will not waste their precious time.",i watch pushpa only mins amp was wondering whats the craze only those with low iq will enjoy such a idiotic movie im shocked got pushpa i hope people will not waste their precious time,i watch pushpa only mins amp was wondering whats the craze only those with low iq will enjoy such a idiotic movie im shocked got pushpa i hope people will not waste their precious time
Many places no logic why not commented. If tamil actress do this mass you will criticise more... Make review honestly and properly for all movies...,many places no logic why not commented if tamil actress do this mass you will criticise more make review honestly and properly for all movies,many places no logic why not commented if tamil actress do this mass you will criticise more make review honestly and properly for all movies
Reshmika itchi ЁЯШВЁЯШВ,reshmika itchi,Rehmika itchi
роЗро╡ро░ ропро╛ро░рпБроорпН родро┐роЯрпНроЯ ро╡рпЗрогро╛роорпН роЕро╡ро░рпН ро╡ропроЪрпБроХрпНроХрпБ роЗроирпНрод рокроЯроорпН рокрпБро░ро┐ропро╛родрпБ рокро┐роЯро┐роХрпНроХро╛родрпБ родро╛родрпНродро╛ рокрпЛропрпН MGR роЪро┐ро╡ро╛роЬро┐ рокроЯродрпНрод рокро╛ро░рпБ родро╛родрпНродро╛ЁЯШЕЁЯШЕ,роЗро╡ро░ ропро░роо родроЯроЯ ро╡рогроо роЕро╡ро░ ро╡ропроЪроХроХ роЗроирод рокроЯроо рокро░ропрод рокроЯроХроХрод родродрод рокроп mgr роЪро╡роЬ рокроЯродрод рокро░ родродрод,MGR Savaja Paradise
"Staring 15 mins роХройро╡рпБ ропро╛,",staring mins роХройро╡ роп,Staring mins роХройро╡ роп
ЁЯШВЁЯШВЁЯШВЁЯШВЁЯШВ,,
Perfect review Sir.. Hats off,perfect review sir hats off,perfect review sir hats off
Genuine review,genuine review,Genuine Review
ЁЯШБЁЯШБЁЯШБЁЯШБЁЯШБЁЯШБЁЯШБyewoo blue sattai..,yewoo blue sattai,Yewoo Blue Sattai
роЯрпЗропрпН роЗроирпНрод роорпКроХрпНроХ рокроЯродрпНродрпБроХрпНроХрпБ роПройрпНроЯро╛ роЗрокрпНрокроЯро┐ роЪрпАройрпН рокрпЛроЯрпБро▒ родропро╡рпБроЪрпЖроЮрпНроЪрпБ ропро╛ро░рпБроорпН рокрпЛропро┐роЯро╛родрпАроЩрпНроХ роЕрокрпНрокроЯро┐ роЪрпКро▓рпНро▓рпБ роирпЗро░рпНроорпИ,роЯроп роЗроирод роороХроХ рокроЯродродроХроХ роПройроЯ роЗрокрокроЯ роЪрой рокроЯро▒ родропро╡роЪроЮроЪ ропро░роо рокропроЯродроЩроХ роЕрокрокроЯ роЪро▓ро▓ роиро░роо,Diamonds are the most common types of people.
рокроЯрооро╛роЯро╛ роЗродрпБ роХрпБрокрпНрокрпИропро┐ро▓рпБроорпН роХрпБрокрпНрокрпИ рокрпЖро░ро┐роп роХрпБрокрпНрокрпИ,рокроЯроороЯ роЗрод роХрокрокропро▓роо роХрокрок рокро░роп роХрокрок,Image
Cha ethala oru padama . 10 mt ku Mela paaka mudila first fight scene laye cut pannite over over Sean ЁЯШдЁЯШд,cha ethala oru padama mt ku mela paaka mudila first fight scene laye cut pannite over over sean,cha ethala oru padama mt ku mela paaka mudila first fight scene laye cut pannite over over sean
Highest gross of the year,highest gross of the year,highest gross of the year
Rashmika pathi sollavea ila,rashmika pathi sollavea ila,Rashmika Pathi Solveaaaaaaaaaaaaaaaaaaaaaaaaaaaa
3rd partra adhu ЁЯШВ blue mutta,rd partra adhu blue mutta,RD PARTRA ADHU BLUE MUTTA
Padam pathiya da blueЁЯШВЁЯШВ,padam pathiya da blue,Path Pathiya da blue
"роОро╡рпНро╡ро│ро╡рпБ роХро┤рпБро╡ро┐ роКродрпНродро┐ройро╛ро▓рпБроорпН рокроЯроорпН 1000 роХрпЛроЯро┐ родро╛рогрпНроЯро┐роЯрпБроЪрпНроЪрпБ рокро╛родрпНродрпБ рокрпЗроЪрпБроЩрпНроХ рокро╛, 3.20 роорогро┐ роирпЗро░роорпН роУроЯро┐ройро╛ро▓рпБроорпН рокроЯроорпН engaging родро╛ройрпН роЗро░рпБроирпНродрпБроЪрпНроЪро┐ роирпАропрпЗ 1st half роиро▓рпНро▓ро╛ роЗро░рпБроХрпНроХрпБрогрпНроЯрпЗ one time watchable ройрпБ роЪрпКройрпНройро╛ро▓рпЗ 1000 crore родро╛рогрпНроЯро┐роЯрпБроорпН родрооро┐ро┤рпН audience роЕро╡рпНро╡ро│ро╡рпБ роХрпКрогрпНроЯро╛роЯрпБро▒ро╛роЩрпНроХ.",роОро╡ро╡ро│ро╡ роХро┤ро╡ роКродродройро▓роо рокроЯроо роХроЯ родрогроЯроЯроЪроЪ рокродрод рокроЪроЩроХ рок роорог роиро░роо роУроЯройро▓роо рокроЯроо engaging родрой роЗро░роиродроЪроЪ роироп st half роиро▓ро▓ роЗро░роХроХрогроЯ one time watchable рой роЪройройро▓ crore родрогроЯроЯроо родрооро┤ audience роЕро╡ро╡ро│ро╡ роХрогроЯроЯро▒роЩроХ,How Much How To Make a Film Code
Mokka padam....ЁЯдгЁЯдг  Fulla cringe <br>NXT balayya readyЁЯШВЁЯШВЁЯШВ,mokka padam fulla cringe brnxt balayya ready,Mokka extinguished Fulla Cringe Brnxt Balayya Ready
Japan fight scene is dream scene for hero... Director shown this scene for hero intro<br>ЁЯШВ,japan fight scene is dream scene for hero director shown this scene for hero introbr,japan fight scene is dream scene for hero director shown this scene for hero introbr
роЗродрпБ роПродрпЛ роЬро╛рокро░рпН роЬро╛родро┐роХрпН рокроЯроорпН рокрпЛро▓ роЗро░рпБроХрпНроХрпБ,роЗрод роПрод роЬрокро░ роЬродроХ рокроЯроо рокро▓ роЗро░роХроХ,This is a multi -faceted film
"роЕроЩрпНроХрпЗ рокроЯроорпН 1000 роХрпЛроЯро┐ родро╛рогрпНроЯро┐, ро░ро┐ро╡ро┐ропрпВ рокрпЛроЯрпНроЯро╡ройрпН ро╡ро╛ропро┐ро▓рпН роОро▓рпНро▓ро╛роорпН роорогрпНрогрпИ рокрпЛроЯрпНроЯрпБроХрпНроХро┐роЯрпНроЯрпБ роЗро░рпБроХрпНроХрпБ...рокрпЛроЩрпНроХрокрпНрокро╛.",роЕроЩроХ рокроЯроо роХроЯ родрогроЯ ро░ро╡роп рокроЯроЯро╡рой ро╡ропро▓ роОро▓ро▓роо роорогрог рокроЯроЯроХроХроЯроЯ роЗро░роХроХрокроЩроХрокрок,The image of the film is available in the film.
ро╡ро╛ропрпНроХрпНроХро╛ро▓рпН родроХро▒ро╛ро▒рпБЁЯШВЁЯШВ,ро╡ропроХроХро▓ родроХро▒ро▒,Agal threll
Ff ah dummy ah kaatitunga waste.1st part la ff oda ego and psycho thanama kovam dha padathuku plus,ff ah dummy ah kaatitunga wastest part la ff oda ego and psycho thanama kovam dha padathuku plus,ff ah dummy ah kaatitunga wastest part la ff oda ego and psycho thanama kovam dha solid huku plus
"Seriously, such a good review.",seriously such a good review,seriously such a good review
"роЙроЯроорпНрокрпБ ро╡ро▓ро┐ропрпЗ, родро▓ро╡ро▓ро┐ропрпЛ роЗро▓рпНро▓рпИЁЯШВЁЯШВ",роЙроЯроорок ро╡ро▓роп родро▓ро╡ро▓роп роЗро▓ро▓,Body Zone Headquarters
Yen intha padatha pakkanum ...same feeling,yen intha padatha pakkanum same feeling,Yen Intha Solidha Pakkanum Same Feeling
5.40 ЁЯШВЁЯШВЁЯШВ,,
2000cr chumma va ЁЯФе,cr chumma va,cr chumma va
Mokka padam,mokka padam,Mokka goes out
роЬрокрпНрокро╛ройрпНроХро╛ро░ройрпН родрооро┐ро┤рпН рокрпЗроЪрпБроорпНрокрпЛродрпБ родрооро┐ро┤ройрпН роЬро╛рокрпНройрпАро╕рпН рокрпЗроЪроХрпНроХрпВроЯро╛родро╛,роЬрокрокройроХро░рой родрооро┤ рокроЪроорокрод родрооро┤рой роЬрокройро╕ рокроЪроХроХроЯрод,Japanagarana Tamil
Athavathu telugu padatha romba telugu padama ethutanga nu review la solran. Enna na solran parunga.,athavathu telugu padatha romba telugu padama ethutanga nu review la solran enna na solran parunga,Athavathu Telugu Solidha Romba Telugu in Ethbata NU NU Review La Solran Enna Na Solran Parunga
Pushpa Purusan Vera Aalu Ya ЁЯШВ blue satta Ivan allu arjun Dubakoor 2 avan no 1 dubakoor,pushpa purusan vera aalu ya blue satta ivan allu arjun dubakoor avan no dubakoor,Pushpa Purusan Vera Aalu Ya Blue Satta Ivan Allu Arjun Dubakoor Avan No DuboOor
Don&#39;t mind the review the movie is ЁЯФе,dont mind the review the movie is,dont mind the review the movie is
Pushpa purushanЁЯШВЁЯШВЁЯШВЁЯШВ,pushpa purushan,Pushpa Purushan
Jealousy kudi,jealousy kudi,Jealousy Kudi
Mental kuthi movie super,mental kuthi movie super,Mental Kuthi Movie Super
Surya thakkapattar,surya thakkapattar,Surya Thakkapattar
рокроЯроорпН роиро▓рпНро▓ро╛ родро╛ роЗро░рпБроХрпНроХрпБ ЁЯФе,рокроЯроо роиро▓ро▓ род роЗро░роХроХ,Image welfare
"He is giving some good review to Pushpa 2, even after the movie is Telugu masala stuff. While he gave the worst review to the one of the best movie(Jigarthanda Double x) .",he is giving some good review to pushpa even after the movie is telugu masala stuff while he gave the worst review to the one of the best moviejigarthanda double x,he is giving some good review to pushpa even after the movie is telugu masala stuff while he gave the worst review to the one of the best moviejigarthanda double x
роЕрокрпНрок роОрокрпНрокроЯро┐роЯро╛ 1000 роХрпЛроЯро┐ collection роЖроЪрпНроЪрпБ,роЕрокрок роОрокрокроЯроЯ роХроЯ collection роЖроЪроЪ,Collection
"Rashmika, Allu Arjun manushangala kooda madhikala paavamЁЯШВЁЯШВЁЯШВ",rashmika allu arjun manushangala kooda madhikala paavam,The Allu Arjun Menshalla Paulka Paavam
Ne oru padam yedu athuku na review panre. ЁЯк┐ЁЯк┐ЁЯк┐ЁЯк┐,ne oru padam yedu athuku na review panre,I don't get to fall Yeda Athuku on Review Panre
Ni oru padam eduthu just 3 crore vasool panni katraa karuvanda...unakum kooda ithana peru support panranga paru idhellam dhan da tamil padam 1000 crore reach panna kastapaduthu,ni oru padam eduthu just crore vasool panni katraa karuvandaunakum kooda ithana peru support panranga paru idhellam dhan da tamil padam crore reach panna kastapaduthu,Ni Oru Out Eduthu Just Crore Vasool Panni Katraa Karuvandaunakum Kooda Ithana Peru Support Panranga Lung Idhellam Dhan Da Tamil Odd Crore Reach Panna Kastapaduthu
"<a href=""https://www.youtube.com/watch?v=MDeOZdbSBCU&amp;t=319"">5:19</a> ЁЯШВЁЯШВЁЯШВЁЯШВ",a href,and href
2000 crores coming soon,crores coming soon,crores coming soon
роЖрогрпНроЯро┐ роЗроирпНродро┐ропройрпН родро╛ройрпН роЕро░рпБроорпИропро╛рой рокроЯроорпН ЁЯШВЁЯШВЁЯШВ,роЖрогроЯ роЗроиродропрой родрой роЕро░рооропрой рокроЯроо,Ordinary
