Comments,Cleaned_Comments,Translated_Comments
Ne saagarthukulla oru movie directe panni 50c collection Pannu ya aprm pesu,ne saagarthukulla oru movie directe panni c collection pannu ya aprm pesu,ne saagarthukulla oru movie direct panni c collection pannu ya aprm pesu
Vungal ki padame puriyala<br>Poyi tamil movies review pannikonga,vungal ki padame puriyalabrpoyi tamil movies review pannikonga,Vungal Ki Padame Puriyalabrpoyi Tamil Movies Review Pannikonga
Yow vayasula periyana iruka una asingama thitta mudiyala vayila nalla varuthu,yow vayasula periyana iruka una asingama thitta mudiyala vayila nalla varuthu,Yow Vayasula Periyana Iuka First Sasingama Thitta Mudiyala Vayila Nalla Varuthu
Was Waiting for this review ЁЯШВЁЯШВЁЯШВ..ЁЯШБЁЯШБЁЯШБ,was waiting for this review,was waiting for this review
рокрпБро▒ро╛ро╡рпБроХрпНроХрпБ роТро░рпБ  рокрпЛро░ро╛роЯро╛ЁЯШДЁЯШГЁЯШАЁЯдг,рокро▒ро╡роХроХ роТро░ рокро░роЯ,Birds
"<a href=""https://www.youtube.com/watch?v=MDeOZdbSBCU&amp;t=320"">5:20</a> jaggabathi babu illa real villain, nee thaan da blue sattai real villain for all cringe movies ЁЯШЕЁЯШЕЁЯШВЁЯШВ",a href jaggabathi babu illa real villain nee thaan da blue sattai real villain for all cringe movies,a href jaggabathi babu illa real villain nee thaan da blue sattai real villain for all cringe movies
"<a href=""https://www.youtube.com/watch?v=MDeOZdbSBCU&amp;t=190"">3:10</a> pudhusa irukku sir<br><a href=""https://www.youtube.com/watch?v=MDeOZdbSBCU&amp;t=206"">3:26</a> sanda pottu mallu katinaaruЁЯШВЁЯШВ<br><a href=""https://www.youtube.com/watch?v=MDeOZdbSBCU&amp;t=268"">4:28</a> <a href=""https://www.youtube.com/watch?v=MDeOZdbSBCU&amp;t=268"">4:28</a> pombala vesham<br><a href=""https://www.youtube.com/watch?v=MDeOZdbSBCU&amp;t=291"">4:51</a> ЁЯШВЁЯШВЁЯШВ<br><a href=""https://www.youtube.com/watch?v=MDeOZdbSBCU&amp;t=320"">5:20</a> jaggabathi babu<br><a href=""https://www.youtube.com/watch?v=MDeOZdbSBCU&amp;t=336"">5:36</a> ЁЯШЕ<br><a href=""https://www.youtube.com/watch?v=MDeOZdbSBCU&amp;t=360"">6:00</a> wfh maathiri ЁЯШВЁЯШВ",a href pudhusa irukku sirbra href sanda pottu mallu katinaarubra href a href pombala veshambra href bra href jaggabathi babubra href bra href wfh maathiri,A Href Pudhusa Irukku Sirbra Href Sanda Pottu Mallu Katinaarubra Href A Href Pombala Veshambra Href Href Jaggabathi Babubra Href Bra Href WFH WFH Maatiri
"<a href=""https://www.youtube.com/watch?v=MDeOZdbSBCU&amp;t=296"">4:56</a> hyder ali thakka pattar ЁЯШВЁЯШВ",a href hyder ali thakka pattar,a href hyder ali thakka pattar
родрооро┐ро┤рпН роЪро┐ройро┐рооро╛ро╡ро┐ройрпН рокро┐ро░роорпНрооро╛рогрпНроЯроорпН рокро▒рпНро▒ро┐роп родроХро╡ро▓рпН рокроЩрпНроХроорпН ЁЯШВЁЯдгЁЯСМ,родрооро┤ роЪройрооро╡рой рокро░роороорогроЯроо рокро▒ро▒роп родроХро╡ро▓ рокроЩроХроо,Information for the Paramana Paramana Paramana
роирпА роОройрпНрой ро╡рпЗрогро╛ роЪрпКро▓рпНро▓рпБ рокроЯроорпН роЪрпВрокрпНрокро░рпН,рои роОройрой ро╡рог роЪро▓ро▓ рокроЯроо роЪрокрокро░,The film is not the same as the film.
"<a href=""https://www.youtube.com/watch?v=MDeOZdbSBCU&amp;t=339"">5:39</a> родро╛роЩрпНроХро┐ родро╛роЩрпНроХро┐ ро░рпКроорпНрок side ро╡ро╛роЩрпНроХро┐ рокрпКропро┐роЯрпНроЯро╛ро░рпБ...ЁЯШВЁЯдг",a href родроЩроХ родроЩроХ ро░роорок side ро╡роЩроХ рокропроЯроЯро░,A href
Why are Tamil movies not running outside TN?,why are tamil movies not running outside tn,why are tamil movies not running outside tn
Vaada vaa ЁЯШВЁЯШВ,vaada vaa,look
"Good movie, not boring, <br>3 hrs gone like just.",good movie not boring br hrs gone like just,Good Movie Not Boring Br HRS Gone Like Just
роЕродрпБ роХройро╡рпБ роЪрпАройрпН ропро╛ роорпБродро▓рпН роГрокрпИроЯрпН,роЕрод роХройро╡ роЪрой роп роородро▓ роГрокроЯ,It is a dream.
роЗроирпНрод рокроЯроорпН роиро▓рпНро▓ро╛ роЗро░рпБроХрпНроХрпБродро╛ роиро▓рпНро▓ро╛ роЗро▓рпНро▓рпИропро╛,роЗроирод рокроЯроо роиро▓ро▓ роЗро░роХроХрод роиро▓ро▓ роЗро▓ро▓роп,This is a picture of the welfare of the film
роОройрпНрой рооро┐ро╕рпНроЯро░рпН<br>роЙроЩрпНроХ роРроЯро┐ропрпЛро▓роЬро┐ рокроЯроЩрпНроХро│рпН роЗродрпБ рокрпЛро▓ роУроЯ рооро╛роЯрпНроЯрпЗроЩрпНроХрпБродрпБ....роЕрокрпНрокроЯро┐родрпНродро╛ройрпЗ?<br><br>роЕроирпНрод роОро░ро┐роЪрпНроЪро▓рпН родро╛ройрпЗ?,роОройрой рооро╕роЯро░brроЙроЩроХ роРроЯропро▓роЬ рокроЯроЩроХро│ роЗрод рокро▓ роУроЯ роороЯроЯроЩроХродроЕрокрокроЯродродройbrbrроЕроирод роОро░роЪроЪро▓ родрой,BRRBRIPS STATEMENT OF THE MANUFACTURING YOUR ITEMS
Love u sir тЭдтЭдтЭд,love u sir,Love in cheese
Nov nee mass naЁЯШВЁЯШВЁЯШВ,nov nee mass na,new nee mass on
Full Padathayum sollitan ЁЯШВ,full padathayum sollitan,Full Padathayum Sollitan
Gooooood movie,gooooood movie,gooooOOOD MOVIE
роороЪро╛ро▓ро╛ рокроЯроорпН ропрпЛро╡рпНЁЯШЕЁЯШЕЁЯШЕЁЯШЕ,роороЪро▓ рокроЯроо ропро╡,Masala
роХро╛роЮрпНроЪро┐рокрпБро░роорпН тЭдтЭдтЭдтЭд роХро╛роЮрпНроЪро┐рокрпБро░роорпН рооро╛ро╡роЯрпНроЯроорпН роЗро│рпИропро╛ро░рпНро╡рпЗро▓рпБро░рпН,роХроЮроЪрокро░роо роХроЮроЪрокро░роо рооро╡роЯроЯроо роЗро│ропро░ро╡ро▓ро░,Kanasaparama Kanagasaparama
Mokka padam,mokka padam,Mokka goes out
Villain yaarunu teryumla jagapathi babuЁЯШЕ,villain yaarunu teryumla jagapathi babu,Villain Yaarunu Teryumla Jagapathi Babu
Politicsa la Work from home panra yaro oruthar sarbaga vetri pera vazuthukkal,politicsa la work from home panra yaro oruthar sarbaga vetri pera vazuthukkal,politicsa la work from home panra yaro oruthar sarbaga vetri pera vazuthukkal
ЁЯШВЁЯШВЁЯШВ,,
Neenga yen sir padam edukkala neenga dha supper a kora soldringale......,neenga yen sir padam edukkala neenga dha supper a kora soldringale,Neenga Yen Sir Sir Edukkala Neenga Dha Supper A Kora Soldringale
Rashmika pathi solave ilayeЁЯШВЁЯШВ,rashmika pathi solave ilaye,Rashmika Pathi solesa soa
National award aana mariyadhe poochuЁЯШвЁЯШвЁЯШв,national award aana mariyadhe poochu,National Award Aana Mariyadhe Poochu
роЬрпЖроХрокродро┐ рокро╛рокрпБ роорпЗро▓ роПройрпН родро▓рпИро╡ро╛ роЕро╡рпНро╡ро│ро╡рпБ роХро╛рогрпНроЯрпБ...,роЬроХрокрод рокрок рооро▓ роПрой родро▓ро╡ роЕро╡ро╡ро│ро╡ роХрогроЯ,Jagapatha Papa Malava Other Talawa
ЁЯСМЁЯСМЁЯе░,,
ЁЯШВЁЯШВЁЯШВЁЯШВЁЯШВ,,
"Puspha padatha vidatha vida, neenga pesurathu than length...... tha poguthu annachi,    anaaaa.. ithu puthusu puthusu .......",puspha padatha vidatha vida neenga pesurathu than length tha poguthu annachi anaaaa ithu puthusu puthusu,puspha padatha vidatha vida neenga pesurathu than length tha poguthu annachi anaaaa ithu puthusu puthusu
Nan ninachatha apdiyae solirkingalae sir <br>Ithu oru normal commercial flim ithuku ivanunga kudukra build up thanga mudila,nan ninachatha apdiyae solirkingalae sir brithu oru normal commercial flim ithuku ivanunga kudukra build up thanga mudila,Nan Ninachatha APDIYAE SOLIRKINGALAE SIR BRITHU ORU NORMAL COMMERCIAL FLIM ITHUKU IVANUNGA DECORIGE BUILD UP THANGA MUDILA
родро▓рпИро╡ро╛ роЕроирпНрод роЬрпЖроХрокродро┐ рокро╛рокрпБ  рокро╛ро╡роорпНропро╛... роЬрпЖроХрокродро┐рокро╛рокрпБ рокро╛ро░рпНроХрпНроХрпБроорпН рокрпЛродрпЖро▓рпНро▓ро╛роорпН роЙройрпН роЮро╛рокроХроорпН родро╛ройрпН  ро╡ро░рпБродрпБ родро▓рпИро╡ро╛ ... роЬрпЖроХрокродро┐ рокро╛рокрпБро╡ро╛ роЯроХрпБрокродро┐ рокро╛рокрпБро╡ро╛  роТро░рпЗ confused ah  роЗро░рпБроХрпНроХрпБ родро▓рпИро╡ро╛  ...ЁЯШЕЁЯШЕЁЯШЕ,родро▓ро╡ роЕроирод роЬроХрокрод рокрок рокро╡роороп роЬроХрокродрокрок рокро░роХроХроо рокродро▓ро▓роо роЙрой роЮрокроХроо родрой ро╡ро░род родро▓ро╡ роЬроХрокрод рокрокро╡ роЯроХрокрод рокрокро╡ роТро░ confused ah роЗро░роХроХ родро▓ро╡,Talawa Jagapatha Pavamayam Paragamma Paragamma Patalamalama Patalamalama Pattalama Pattalama Pattalamala Jagapatha Papatha Papatha Papatha Papatha Papatha Papatha Papatha Papatha Pathalama Paragapatha
Enna indha alu nalla irukku nu soluran ЁЯдФЁЯдФЁЯдФЁЯдФЁЯдФЁЯдФЁЯдФ,enna indha alu nalla irukku nu soluran,Enna Indha Alu teddyon Irku Irku Nu Solura
роЗроирпНрод ро╡роирпНродрпБроЯрпНроЯро╛ро░рпБ рокрпБро╖рпНрокро╛ рокрпБро░рпБро╖ройрпН,роЗроирод ро╡роиродроЯроЯро░ рокро╖рок рокро░ро╖рой,This is the case
Padam nalla eruku jolly aa poi pakalaam    evaru logics kandipuduchi pudichi  Tamil cinema va olichi vitanga,padam nalla eruku jolly aa poi pakalaam evaru logics kandipuduchi pudichi tamil cinema va olichi vitanga,Padam Nalla Eruku Jolly Aa Poi Pakiam Evu Logics Kandipuuchi Pudich Pudich Tamil Cinema Va olchi Vitanga
рооройроЪрпБро▓ роЙро│рпНро│ рокро╛ро░роорпЗ роХрпКро▒роЮрпНроЪро┐роЯрпБроЪрпНроЪрпБ.ЁЯШВЁЯШВЁЯШВ,рооройроЪро▓ роЙро│ро│ рокро░роо роХро▒роЮроЪроЯроЪроЪ,Manasala
Padam mass super,padam mass super,SUPER SUPER MASS
2026 la serupadi vanga pogum setup star sarbaga vetri pera vazuthukkal,la serupadi vanga pogum setup star sarbaga vetri pera vazuthukkal,La Serupadi Vanga Pogum Setup Star Sarbaga Vetri Pera Vazuthukkal
"<a href=""https://www.youtube.com/watch?v=MDeOZdbSBCU&amp;t=339"">5:39</a> родро╛роЩрпНроХро┐ родро╛роЩрпНроХро┐ ро░рпКроорпНрок side ро╡ро╛роЩрпНроХро┐ роЗро░рпБрокрпНрокро╛ро░рпБ ЁЯШЕЁЯШЕ",a href родроЩроХ родроЩроХ ро░роорок side ро╡роЩроХ роЗро░рокрокро░,a href родроЩроХ родроЩроХ ро░роорок side ро╡роЩроХ роЗро░рокрокро░
"<a href=""https://www.youtube.com/watch?v=MDeOZdbSBCU&amp;t=345"">05:45</a> Kanguvaaaaa",a href kanguvaaaaa,a href kangavaaaaaa
"<a href=""https://www.youtube.com/watch?v=MDeOZdbSBCU&amp;t=348"">05:48</a> Kangu vaaaa",a href kangu vaaaa,a href kanga vaaaaa
"<a href=""https://www.youtube.com/watch?v=MDeOZdbSBCU&amp;t=355"">05:55</a> Kanguva ЁЯШВЁЯШВЁЯШВЁЯШВЁЯШВЁЯШВ",a href kanguva,a href a snake
Poda p........daaЁЯШЕЁЯШЕЁЯШЕ,poda pdaa,gives a pdaa
"<a href=""https://www.youtube.com/watch?v=MDeOZdbSBCU&amp;t=355"">05:55</a> Kanguva ЁЯШВЁЯШВЁЯШВЁЯШВЁЯШВЁЯШВ",a href kanguva,a href a snake
Ennaya geniune review lam panra...with sarcasticЁЯШВЁЯШВ,ennaya geniune review lam panrawith sarcastic,ennaya geniune review lam panrawith sarcastic
Yov jagabathi babu mela unna ennaya kovam,yov jagabathi babu mela unna ennaya kovam,Yov Jagabathi Babu Mela Unna Ennaya Kovam
ЁЯШВ рокропро▒рпБроЯро╛ рокропро▒рпБроЯро╛ роОройрпНро▒рпБ роЙропро┐ро░ роОроЯрпБрокрпНрокро╛роЩрпНроХ<br>родро╛роЩрпНроХрпБ родро╛роЩрпНроХрпБройрпНройрпБ родро╛роЩрпНроХро┐ ро░рпКроорпНрок роЪро╛ропрпНроЪро┐роЯрпНроЯро╛ро░рпБЁЯШВЁЯШВЁЯШВ,рокропро▒роЯ рокропро▒роЯ роОройро▒ роЙропро░ роОроЯрокрокроЩроХbrродроЩроХ родроЩроХройрой родроЩроХ ро░роорок роЪропроЪроЯроЯро░,BRIVERY PROPERTY BRIVERY STATEMENT
Thanki thanki side vankiruchu ЁЯШВЁЯШВ,thanki thanki side vankiruchu,thankki thankki side vankiruchu
Siruthai siva thaakkapattarЁЯШВ,siruthai siva thaakkapattar,siruthai siva Thakakattar
Mental go and see movie one more time <br>Then give you a review,mental go and see movie one more time brthen give you a review,mental go and see movie one more time brthen give you a review
Build up only,build up only,build up only
Poi inu oru vatyy movie per blue Satta paiytjya karaa,poi inu oru vatyy movie per blue satta paiytjya karaa,POI INU ORU VATYY MOVIE PER BLUE SATTTA JOVE JAKA Kara
рокрпБро╖рпНрокро╛ роХрогро╡ро░рпН роЪро╛ро░рпНрокро╛роХ роЗроирпНрод рокроЯроорпН ро╡рпЖро▒рпНро▒ро┐ рокрпЖро▒ ро╡ро╛ро┤рпНродрпНродрпБроХро│рпНЁЯШВЁЯШВ,рокро╖рок роХрогро╡ро░ роЪро░рокроХ роЗроирод рокроЯроо ро╡ро▒ро▒ рокро▒ ро╡ро┤родродроХро│,Pashabha Husband Sarabhaka
Oru photokkaaga postingaye maathittaan,oru photokkaaga postingaye maathittaan,ORU Photokaaga Postingaye to Maathta
Appo movie nalla irukumaЁЯзР,appo movie nalla irukuma,Appo Movie Nalla Irukuma
"<a href=""https://www.youtube.com/watch?v=MDeOZdbSBCU&amp;t=339"">5:39</a> Thaangi thaangi side vangitapula",a href thaangi thaangi side vangitapula,A href thangi thangi side vangitapula
Intha movie ku tamil adiance thevaye illa blu sattai hindi adiance mattum pothum ЁЯШДЁЯШДЁЯШДЁЯШДЁЯШД,intha movie ku tamil adiance thevaye illa blu sattai hindi adiance mattum pothum,Intha movie ku tamil adiance thevaye illa blue sattai hindi adiance maritum pothum
Nakal ya onaku,nakal ya onaku,Nakal of Onaku
родрпЖро▓рпБроЩрпНроХрпБ рокроЯродрпНродрпИ рокро╛ро░рпНрокрпНрокродро▒рпНроХрпБ роорой родрпИро░ро┐ропроорпН ро░рпКроорпНрок роорпБроХрпНроХро┐ропроорпН роЖроирпНродро┐ро░ родрпЗроЪроорпН ро╡ро│ро░рпНроЪрпНроЪро┐ рокрпЖро▒рпНро▒рпБ ро╡ро┐роЯрпНроЯродрпБ роОройрпНро▒ро╛ро░рпНроХро│рпН роЕро╡ройрпБроЩрпНроХ роОроЯрпБроХрпНроХрпБро▒ рокроЯродрпНродрпИ ро╡рпИродрпНродрпЗ родрпЖро░ро┐роирпНродрпБ ро╡ро┐роЯрпБроорпН роЕроХрпНроХроЯрпБ рооройро┐родро░рпНроХро│ро┐ройрпН ро╡ро│ро░рпНроЪрпНроЪро┐,родро▓роЩроХ рокроЯродрод рокро░рокрокродро▒роХ роорой родро░ропроо ро░роорок роороХроХропроо роЖроиродро░ родроЪроо ро╡ро│ро░роЪроЪ рокро▒ро▒ ро╡роЯроЯрод роОройро▒ро░роХро│ роЕро╡ройроЩроХ роОроЯроХроХро▒ рокроЯродрод ро╡родрод родро░роирод ро╡роЯроо роЕроХроХроЯ рооройродро░роХро│рой ро╡ро│ро░роЪроЪ,"Growing up of the quality of the quality of the quality of the world, the quality of the quality of the world, the quality of the quality of the world."
Pushpa purushan  ЁЯШВЁЯШВ,pushpa purushan,Pushpa Purushan
dey Tamil movie edhukku 1000crs varadhu idhukkudha world fulla movie kaondada paduthu neenga mattu vytherichal nakkal pandrigla saavungada neengellam,dey tamil movie edhukku crs varadhu idhukkudha world fulla movie kaondada paduthu neenga mattu vytherichal nakkal pandrigla saavungada neengellam,Dey Tamil Movie Edhukku crs assethuki id hukhukudha World Fulla Movie to eliminate paduthu nevenga buried vytherichal infection pandrigla achieved neennellam
Kangvas and Indian 2 together lifetime achievement is achieved within one day by Pushpa 2 .ЁЯШВЁЯШВ Still Kollywood is very backward.,kangvas and indian together lifetime achievement is achieved within one day by pushpa still kollywood is very backward,kangvas and indian together lifetime achievement is achieved within one day by pushpa still kollywood is very backward
роЗродрпЗ родрооро┐ро┤рпН роорпВро╡ро┐ропро╛ роЗро░рпБроирпНродро╛ роТро░рпБ рокро╛роЪро┐роЯрпНроЯро┐ро╡рпН  роХрпВроЯ роЪрпКро▓рпНро▓ро┐ро░рпБроХрпНроХ рооро╛роЯрпНроЯро╛ роЗро╡,роЗрод родрооро┤ рооро╡роп роЗро░роирод роТро░ рокроЪроЯроЯро╡ роХроЯ роЪро▓ро▓ро░роХроХ роороЯроЯ роЗро╡,This is one of the most important things to do
2.20 hrs. Circus.  Stunts in air. Tied leg  toiled both hands and legs. New circus in movies. Sukumar missed his directions .,hrs circus stunts in air tied leg toiled both hands and legs new circus in movies sukumar missed his directions,hrs circus stunts in air tied leg toiled both hands and legs new circus in movies sukumar missed his directions
Pushapa 2 1000 kodi than pola ЁЯШоЁЯШоЁЯШоЁЯШо,pushapa kodi than pola,Pushapa Kodi Than Pattern
Nenga  padam nalla pathengla ila cutting pottu thungetenglaЁЯШВ padam average tha nenga review pannunadu scene Elam olapal panrenga,nenga padam nalla pathengla ila cutting pottu thungetengla padam average tha nenga review pannunadu scene elam olapal panrenga,Nenga extinguished Nalla Pathengla ila Cutting Pottu Thungetengla Average Tha Nenga Review Pannunadu Scene Elam Olapal Panrenga
роЙроЩрпНроХро│рпБроЯрпИроп ро░ро┐ро╡рпАро╡рпБроХрпНроХро╛роХ родро╛ройрпН роХро╛родрпНродрпБроХрпНроХро┐роЯрпНроЯрпБ роЗро░рпБроирпНродрпЗройрпН рокроЯроорпН рокро╛роХрпНроХро▓ро╛рооро╛ ро╡рпЗрогро╛рооро╛ роОройрпНро▒рпБ роиройрпНро▒ро┐,роЙроЩроХро│роЯроп ро░ро╡ро╡роХроХроХ родрой роХродродроХроХроЯроЯ роЗро░роиродрой рокроЯроо рокроХроХро▓роо ро╡рогроо роОройро▒ роиройро▒,You will be able to make a picture of your story.
Meth vikiravan kooda laam photo eduthu irukanga past la,meth vikiravan kooda laam photo eduthu irukanga past la,Meth Vikiravan Kooda Laam Photo Edushi Irukanga Past la
"<a href=""https://www.youtube.com/watch?v=MDeOZdbSBCU&amp;t=363"">6:03</a> work from home uhh maari acting in movie ЁЯдгЁЯдгЁЯдгЁЯдгЁЯдг",a href work from home uhh maari acting in movie,a href work from home uhh maari acting in movie
Kongvas learn to make films like this.,kongvas learn to make films like this,Kongvas Learn to Make Films Like this
Evan Ella padathaiyum negative va solliye periya alla aaitan,evan ella padathaiyum negative va solliye periya alla aaitan,Evan Ella Padathaiyum Negative Va Solliye Periya at AAITAN
Pushpa 2 Vera level ЁЯФеЁЯФеЁЯФеЁЯФе,pushpa vera level,Pushpa Vera Level
"<a href=""https://www.youtube.com/watch?v=MDeOZdbSBCU&amp;t=200"">3:20</a> nalla irukea scene...",a href nalla irukea scene,a href nalla irukea scene
"Evan 1000 C, 2000 C vasul panra padathiye entha nai Kora than sollum",evan c c vasul panra padathiye entha nai kora than sollum,Evan c c Vasul panra padathiye entha fucked kora than sollum
"<a href=""https://www.youtube.com/watch?v=MDeOZdbSBCU&amp;t=48"">0:48</a> review start ЁЯШЕ",a href review start,a href review start
Flop Padam,flop padam,flop padam
Pushpa purusanЁЯШВЁЯШВЁЯШВ,pushpa purusan,Pushpa Pembangan
Vanakkam Thalaivarae,vanakkam thalaivarae,vanakkam thalavoivae
Ne eppu un vaayala nalladi sollachiЁЯШВЁЯШВЁЯШВЁЯШВЁЯШВЁЯШВЁЯШВЁЯШВЁЯШВЁЯШВЁЯШВ<br><br><br><br>Ke ku..,ne eppu un vaayala nalladi sollachibrbrbrbrke ku,yet a vaayala nalladi sollachibrbrbrbrke ku
"<a href=""https://www.youtube.com/watch?v=MDeOZdbSBCU&amp;t=350"">5:50</a> Atlee thakkapattar",a href atlee thakkapattar,a href atlee thakkapattar
"<a href=""https://www.youtube.com/watch?v=MDeOZdbSBCU&amp;t=350"">5:50</a>ЁЯШВЁЯШВЁЯШВЁЯШВЁЯШВЁЯШВ",a href,and href
ЁЯШВ,,
"<a href=""https://www.youtube.com/watch?v=MDeOZdbSBCU&amp;t=392"">6:32</a>  same feeling tha enakuЁЯШВЁЯШВ",a href same feeling tha enaku,a href same feeling tha enaku
Logic ellam boomila potachitu tha padam parka poganum,logic ellam boomila potachitu tha padam parka poganum,Logic Ellam Boomila Potachitu Tha Parka Poganum
ро╡ро┐ро▓рпНро▓ройрпН ропро╛ро░рпБ родрпЖро░ро┐ропрпБрооро┐ро▓рпНро▓ роЬрпЖроХрокродро┐ рокро╛рокрпБ ЁЯШЕ,ро╡ро▓ро▓рой ропро░ родро░ропрооро▓ро▓ роЬроХрокрод рокрок,Valana Yara Dharamala Jagapatha Papa
Padam Marana mass,padam marana mass,Out to Marana Mass
роЕрогрпНрогрпЗ роЗродрпБ рокрпБродрпБроЪро╛ роЗро░рпБроХрпНроХрпБ,роЕрогрог роЗрод рокродроЪ роЗро░роХроХ,This is a variety
Paithya sikrama vantrakka,paithya sikrama vantrakka,paithya sikrama vantrakka
"3 роорогро┐ роирпЗро░родрпНродрпБроХрпНроХрпБ роЖроЯро┐ропройрпНро╕ роЙроЯрпНроХро╛ро░ ро╡роХрпНроХ роорпБроЯро┐ропрпБроорпНройро╛ роЕродрпБ kjf, pushpa ро╡рпБроХрпНроХрпБ роороЯрпНроЯрпБроорпНродро╛ройрпН",роорог роиро░родродроХроХ роЖроЯропройро╕ роЙроЯроХро░ ро╡роХроХ роороЯропроорой роЕрод kjf pushpa ро╡роХроХ роороЯроЯроородрой,KJF Pushpa
"Padathula cringe illa, padamea cringe Tha...",padathula cringe illa padamea cringe tha,padathula cringe illa padamea cringe tha
Sema allu arjun sethuruvan,sema allu arjun sethuruvan,Sema allu arjun Sethuruvan
"<a href=""https://www.youtube.com/watch?v=MDeOZdbSBCU&amp;t=332"">5:32</a>ЁЯШВЁЯШВЁЯШВ",a href,and href
Work from home ЁЯШВЁЯШВЁЯШВ,work from home,work from home
was waitng fr ur review sir,was waitng fr ur review sir,was waitng fr ur review sir
Story full ha sollotanga idiotЁЯШВЁЯШВ,story full ha sollotanga idiot,Story Full Ha Solllotanga Idiot
Podu lusu tamil movie kalikaluvi othura ana telungu movie matum super sollura poda,podu lusu tamil movie kalikaluvi othura ana telungu movie matum super sollura poda,podu lusu tamil moovie kalikalui othura ana telungo moistum super sollura poda
