Comments,Cleaned_Comments,Translated_Comments
Jagapathibaabu mela роЙроЩрпНроХро│рпБроХрпНроХрпБ роОройрпНрой роХрпЛро╡роорпН..,jagapathibaabu mela роЙроЩроХро│роХроХ роОройрой роХро╡роо,JAGAPATHIBABU MELA роЙроЩроХро│роХроХ роОройрой роХро╡роо
ЁЯШВЁЯШВЁЯШВ,,
Nee yevlo katharanalum padam 1000cr confirm,nee yevlo katharanalum padam cr confirm,nee yevlo katharanalum padam cr confirm
Dei first scene dream da,dei first scene dream da,Dei First Scene Dream Yes
ропрпВ рокрпБро│рпБ роЪроЯрпНроЯрпИ рокроЩрпНроХроорпН рокроЩрпНроХроорпН,роп рокро│ роЪроЯроЯ рокроЩроХроо рокроЩроХроо,Balance Sheet
ЁЯШВЁЯШВЁЯШВЁЯШВ,,
рокроЪрпНроЪрпИ роЪроЯрпНроЯ роороЯрпНроЯрпБроорпНродро╛ройрпН родрпЖро░ро┐ропрпБродрпБ роХрпАро┤рпЗ роОродро╛ро╡родрпБ рокрпЛроЯрпНроЯрпБ роЗро░рпБроХрпНродро┐ропро╛роЯро╛ роорпБроХрпНроХро┐ропрооро╛ ропроЯрпНроЯро┐ рокрпЛроЯро┐роХро┐ропро╛роЯро╛ЁЯШЕЁЯШЕ,рокроЪроЪ роЪроЯроЯ роороЯроЯроородрой родро░ропрод роХро┤ роОродро╡род рокроЯроЯ роЗро░роХродропроЯ роороХроХропроо ропроЯроЯ рокроЯроХропроЯ,What is the best way to do this
"рокро┐ро░рооро╛рогрпНроЯроорпН ,  роХродрпИ роТройрпНро▒рпБроорпН роЗро▓рпНро▓рпИ , роЕрогрпНрогройрпН рокрпНро│рпВ роЪроЯрпНроЯрпИ роЕро╡ро░рпНроХро│рпН роЪрпКройрпНройродрпБ рокрпЛро▓ рокроЯродрпНродрпИ роОродро▒рпНроХрпБ рокро╛ро░рпНродрпНродрпЛроорпН роОройрпНро▒рпБ родрпЛройрпНро▒рпБроХро┐ро▒родрпБ ,But Not Boring .",рокро░роорогроЯроо роХрод роТройро▒роо роЗро▓ро▓ роЕрогрогрой рокро│ роЪроЯроЯ роЕро╡ро░роХро│ роЪройройрод рокро▓ рокроЯродрод роОродро▒роХ рокро░родродроо роОройро▒ родройро▒роХро▒род but not boring,Paramanadama Story
Moreover he will convert the wooden logs into bullock carts. WhatтАЩs the use of finished products! What will the buyer do with that?,moreover he will convert the wooden logs into bullock carts whats the use of finished products what will the buyer do with that,moreover he will convert the wooden logs into bullock carts whats the use of finished products what will the buyer do with that
Goomallo Block Baster Movie... тЭд,goomallo block baster movie,goomallo block baster movie
"роЕрокрпНрокроЯро┐ропрпЗ роиро╛ройрпН роиро┐ройрпИродрпНродродрпИ роЪрпКро▓рпНро▓ро┐ ро╡ро┐роЯрпНроЯрпАро░рпНроХро│рпН, родро▓рпИро╡ро░рпЗ,, роЖройро╛ро▓рпБроорпН рокроЯроорпН ok, роТро░рпБ роорпБро▒рпИ рокро╛ро░рпНроХрпНроХро▓ро╛роорпН,,",роЕрокрокроЯроп роирой роиройродродрод роЪро▓ро▓ ро╡роЯроЯро░роХро│ родро▓ро╡ро░ роЖройро▓роо рокроЯроо ok роТро░ рооро▒ рокро░роХроХро▓роо,Apadaya Nana Nanadatha Salala Vadadarakala Talavarama Analama Image OK
рокрпБро╖рпНрокро╛ рогро╛ роГрокрпНро│ро╡ро░рпНрогрпБ  роиро┐ройрпИроЪрпНроЪро┐ропро╛  рокрпА роЯро╛ рокро┐ ЁЯШнЁЯдв,рокро╖рок рог роГрокро│ро╡ро░рог роиройроЪроЪроп рок роЯ рок,PASSABLE PROPERTY
Nee poi padam edu nalla padam onnu,nee poi padam edu nalla padam onnu,nee Poi Poam Success Nalla Padam Haws
ЁЯШв,,
Jay Jay movie learn Bengali 30days ЁЯШВЁЯШВЁЯШВЁЯШВ,jay jay movie learn bengali days,Jay Jay Movie Learn Bengali Days
Work from home green mat movies ЁЯШВЁЯШВЁЯШВ Vijay movies ЁЯШВЁЯШВЁЯШВ,work from home green mat movies vijay movies,Work from Home Green Mat Movies Vijay Movies
Allu Arjun king all world kingтЭдтЭдтЭдтЭдтЭдтЭдтЭд,allu arjun king all world king,Allo Arjun King All World King
"it&#39;s really a worth and best movie for Telugu audience...1st part is for all audience...part 2 is for Telugu audience....<a href=""https://www.youtube.com/watch?v=MDeOZdbSBCU&amp;t=201"">3:21</a>mins is not boring and not lag in some scene...but it&#39;s not a family audience movie",its really a worth and best movie for telugu audiencest part is for all audiencepart is for telugu audiencea href is not boring and not lag in some scenebut its not a family audience movie,its really a worth and best movie for telugu audiencest part is for all audiencepart is for telugu audiencea href is not boring and not lag in some scenebut its not a family audience movie
Irunga Bhai Na innum Pushpa 1 hey paakala BhaiЁЯШЕЁЯШЕЁЯШЕ,irunga bhai na innum pushpa hey paakala bhai,irunga bhai na innum pushpa hey paida bhai
"<a href=""https://www.youtube.com/watch?v=MDeOZdbSBCU&amp;t=319"">5:19</a> ЁЯШВ",a href,and href
"Japan karan Japanese la tha pesuran, allu arjun num Japanese la pesuran in telugu movie...<br><br>Tamil dubbing la tha antha mathiri panitanga ... Watch movie in telugu once .",japan karan japanese la tha pesuran allu arjun num japanese la pesuran in telugu moviebrbrtamil dubbing la tha antha mathiri panitanga watch movie in telugu once,Japan Karan Japanese La Tha Pesuran Allu Arjun Num Japanese La Pesuran in Telugu Moviebrtamil Dubbing La THA Antha Mathiri Panita Watch Movie in Telugu Once
ЁЯШВ,,
роЪроороирпНродро╛ро╡рпБроХрпНроХро╛ роУроЯро┐ропродрпБ ЁЯШоЁЯШороЕроирпНрод рокро╛роЯрпНроЯрпБроХрпНроХрпБродрпН родро╛ройрпН роУроЯро┐ропродрпБ,роЪроороиродро╡роХроХ роУроЯропрод роЕроирод рокроЯроЯроХроХрод родрой роУроЯропрод,The image of the film is not the same
Yen entha padatha pakanumЁЯШВЁЯШВ,yen entha padatha pakanum,Yen Entha Solidha Pakanum
Padathoda kathaiya neeye 5 mins la solta avan nadicha 3.23hrs padathuku enna mariyadha,padathoda kathaiya neeye mins la solta avan nadicha hrs padathuku enna mariyadha,Kathaya Kathaya Neye Nadise with Solta Avan Nadicha Hrs Padathu is
тЭдя╕ПЁЯСМ,,
Mokka movie flop pushpa 2 ЁЯджЁЯдХ,mokka movie flop pushpa,Mokka Movie Flop Pushpa
Mokka avanu Japanese lo pesindha,mokka avanu japanese lo pesindha,LOOK OPEN OPEN JANAPE LO PESINDHA
Padam mayru maari iruku. Telugu padamna Nalla irukunu solran. Ithuve Tamil padam nai kaluvi uthirukum.,padam mayru maari iruku telugu padamna nalla irukunu solran ithuve tamil padam nai kaluvi uthirukum,extinguished mayru maari iruku telugu on nalla irukunu solran ithuve tamil extinguished nai kaluvi uthirukum
Blue sattai&#39;s all time favorite villain jagapathi babu ЁЯдгЁЯШВ,blue sattais all time favorite villain jagapathi babu,Blue Sattis All Time Favorite Villain Jagapathi Babu
"Yoww dabbing padam na dabbingla than ya oodu ,paithiyakaraa",yoww dabbing padam na dabbingla than ya oodu paithiyakaraa,YOWW DABBING PADAM NA DABBINGLA than ya oodu
Devara ntr action and anirudh music next level,devara ntr action and anirudh music next level,devara ntr action and anirudh music next level
Devara best pushpa worst,devara best pushpa worst,Devara Best Pushpa Worst
роТро░рпБ рокроЯроорпН роОроЯрпБроХрпНроХ роОро╡рпНро╡ро│ро╡рпБ,роТро░ рокроЯроо роОроЯроХроХ роОро╡ро╡ро│ро╡,"Once a film is a film, a film is a film, a film is a film, how much is how much, how much is it, how much is it, how much is a film."
роЗро▓рпНро▓,роЗро▓ро▓,Out
"ЁЯОЙЁЯОЙЁЯОЙрокрпБро╖рпНрокро╛ 2 рокроЯроорпН роорпКродрпНродродрпНродро┐ро▓рпН роиро▓рпНро▓ рокроЯроорпН. тЭдрокро╛ро░рпНроХрпНроХродрпН родроХрпНроХродрпБ. тЭдрокрпКро▒ро╛роорпИ роЕроЯро┐рокрпНрокроЯрпИропро┐ро▓ро╛рой ро╡роХрпНроХро┐ро░рооро╛рой роХро░рпБродрпНродрпБроХрпНроХро│рпИропрпБроорпН роХро░рпБродрпНродрпИропрпБроорпН роироорпНрокро╛родрпАро░рпНроХро│рпН. роЗродрпБ роОройродрпБ роЙрогрпНроорпИропро╛рой, роирпЗро░рпНроорпИропро╛рой роХро░рпБродрпНродрпБ.тЭд роиро╛ройрпН роОроирпНрод роЗроирпНродро┐роп роорпКро┤ро┐родрпН родро┐ро░рпИрокрпНрокроЯродрпНродро┐ро▒рпНроХрпБроорпН роЪро┐ро▒роирпНрод ро░роЪро┐роХройрпН. тЭдроЗроирпНродродрпН родро┐ро░рпИрокрпНрокроЯроорпН роЗроирпНродро┐ропро╛ро╡ро┐ройрпН рокрпЖро░рпБроорпИроХрпНроХрпБро░ро┐роп рооро╛ро╕рпН роороЪро╛ро▓ро╛ рокроЯроорпН. тЭдроХро┐ро░ро╛роо рокрпКро░рпБро│ро╛родро╛ро░ роЙроирпНродрпБроЪроХрпНродро┐. роЕро░рпНроЬрпБройро┐ройрпН роироЯро┐рокрпНрокрпБ роЙройрпНройродрооро╛ройродрпБ. тЭдроЕродро┐роХрооро╛рой роЕродро┐ро░роЯро┐ роХро╛роЯрпНроЪро┐роХро│рпН роЙро│рпНро│рой. роТро░рпБ ро╡роЪродро┐ропро╛рой роиро╛ро│ро┐ро▓рпН родро┐ропрпЗроЯрпНроЯро░ро┐ро▓рпН роХрпБроЯрпБроорпНрок роЙро▒рпБрокрпНрокро┐ройро░рпНроХро│рпБроЯройрпН роЗроирпНродрокрпН рокроЯродрпНродрпИрокрпН рокро╛ро░рпБроЩрпНроХро│рпН. тЭд",рокро╖рок рокроЯроо роородродродродро▓ роиро▓ро▓ рокроЯроо рокро░роХроХрод родроХроХрод рокро▒роо роЕроЯрокрокроЯропро▓рой ро╡роХроХро░роорой роХро░родродроХроХро│ропроо роХро░родродропроо роироорокродро░роХро│ роЗрод роОройрод роЙрогрооропрой роиро░рооропрой роХро░родрод роирой роОроирод роЗроиродроп рооро┤род родро░рокрокроЯродродро▒роХроо роЪро▒роирод ро░роЪроХрой роЗроиродрод родро░рокрокроЯроо роЗроиродропро╡рой рокро░роороХроХро░роп рооро╕ роороЪро▓ рокроЯроо роХро░роо рокро░ро│родро░ роЙроиродроЪроХрод роЕро░роЬройрой роироЯрокрок роЙройройродрооройрод роЕродроХроорой роЕродро░роЯ роХроЯроЪроХро│ роЙро│ро│рой роТро░ ро╡роЪродропрой роиро│ро▓ родропроЯроЯро░ро▓ роХроЯроорок роЙро▒рокрокройро░роХро│роЯрой роЗроиродрок рокроЯродродрок рокро░роЩроХро│,This is the most common type of rainforest in the world of the image of the image of the world. This is the most important thing in the world for the purpose of conducting a business.
"<a href=""https://www.youtube.com/watch?v=MDeOZdbSBCU&amp;t=53"">0:53</a> review startЁЯШв",a href review start,a href review start
Good review. Will not watch !,good review will not watch,good review will not watch
"keep making fun . movie collected 400 cr in 2 days , its breaking all records, but dont worry keep making fun bcoz thats the max we can do. no wonder why we cant make bigger and better movies that succeed.",keep making fun movie collected cr in days its breaking all records but dont worry keep making fun bcoz thats the max we can do no wonder why we cant make bigger and better movies that succeed,keep making fun movie collected cr in days its breaking all records but dont worry keep making fun bcoz thats the max we can do no wonder why we cant make bigger and better movies that succeed
Yan intha padatha pakkanm ЁЯШЕЁЯШЕЁЯШЕЁЯШЕ,yan intha padatha pakkanm,Yan Intha Solidha Pakkanm
Dey intha movie la first scene ku pushpa the rise la first scene od sambandham irukku.. ЁЯШВЁЯШВЁЯШВЁЯШВ padam nalla pathit review pod saami.. ЁЯШВЁЯШВЁЯШВЁЯШВjapan lu tha indha padam first part lu aarambhikaruth... ЁЯШВЁЯШВЁЯШВЁЯШВ,dey intha movie la first scene ku pushpa the rise la first scene od sambandham irukku padam nalla pathit review pod saami japan lu tha indha padam first part lu aarambhikaruth,dey intha movie la first scene ku pushpa the rise la first scene od sambandham irukku padam nalla pathit review pod saami japan lu tha indha padam first part lu aarambhikaruth
Sema movie тЭд,sema movie,Semie Movie
ро╡рпЖро▒рпБроорпН рокрпБро░рпКроорпЛро╖ройрпН and build-up родро╛ройрпН роЗро░рпБроХрпНроХрпБ. рокроЯроорпН роОроЯрпБроХрпНроХрпБро▒рпЛроорпН роЕрокрпНроЯро┐роЩрпНроХрпБро▒ рокрпЗро░рпНро▓ роЙропро┐ро▒ роЗроЯрпБроХрпНроХро░ро╛ройрпБроХ,ро╡ро▒роо рокро░рооро╖рой and buildup родрой роЗро░роХроХ рокроЯроо роОроЯроХроХро▒роо роЕрокроЯроЩроХро▒ рокро░ро▓ роЙропро▒ роЗроЯроХроХро░ройроХ,Paramasana and Buildup The film is not the same as the image of the film.
Dai.. Loosu Ku starting vara scene dream da.. Mairu.  Ne Elam ena review panrannu therla,dai loosu ku starting vara scene dream da mairu ne elam ena review panrannu therla,Dai Loos ku Starting cheats scenes dreams that mairo no ela ena revised Panrann Therla
ро╡ро╛ропрпН ро╡ро┐рокроЪрпНроЪро╛ро░ройрпН,ро╡роп ро╡рокроЪроЪро░рой,Age of age
Adey ennada sollre..nalaa irriki ani sollre nalla illa ani sollre...yennada soll├а vare ЁЯШВЁЯШВЁЯШВ,adey ennada sollrenalaa irriki ani sollre nalla illa ani sollreyennada soll├а vare,Adey Ennada Sollrenalaa Iriki Ani Sollre Nalla Illa Ai Sollreyennada Soll├а Vare
ро░ро╛ро╖рпНрооро┐роХро╛:- роиро▓рпНро▓ ро╡рпЗро│рпИ ро╡рогрпНроЯро┐ роироорпНроо рокроХрпНроХроорпН родро┐ро░рпБроорпНрокро▓,ро░ро╖роороХ роиро▓ро▓ ро╡ро│ ро╡рогроЯ роироороо рокроХроХроо родро░роорокро▓,Rashamaka Nalala Valada Namama Bhagagama Dharamapala
DSP:- роОройрпНрой роироорпНрооро▓ рокродрпНродро┐ роХро┤рпБро╡рпБро▓,dsp роОройрой роироорооро▓ рокродрод роХро┤ро╡ро▓,Dsp
роорпКродрпНродродрпБро▓ рокрпБро╖рпНрокро╛ рокрпБро╕рпНро╕рпНро╕рпНрокрпНрокро╛роЖроЖроЖ,роородродродро▓ рокро╖рок рокро╕ро╕ро╕рокрокроЖроЖроЖ,Religion
ЁЯШВЁЯШВЁЯШЕ,,
Sattai ur too old <br>First day 295 crores ЁЯФе,sattai ur too old brfirst day crores,sattai ur too old brfirst day crores
Evana na kollama irukka matten,evana na kollama irukka matten,Evana na Kollama Irukka Matten
To be Frank he don&#39;t like any movies ЁЯШВ,to be frank he dont like any movies,to be frank he dont like any movies
роХроЩрпНроХрпБро╡ро╛ рокро┐ро░роорпНрооро╛рогрпНроЯ родропро╛ро░ро┐рокрпНрокрпБ роЪро╛ро░рпНрокро╛роХ рокрпБро╖рпНрокро╛ - 2 ро╡рпЖро▒рпНро▒ро┐ рокрпЖро▒ ро╡ро╛ро┤рпНродрпНродрпБроХрпНроХро│рпН,роХроЩроХро╡ рокро░роороорогроЯ родропро░рокрок роЪро░рокроХ рокро╖рок ро╡ро▒ро▒ рокро▒ ро╡ро┤родродроХроХро│,Paradise
Youtube have to Ban this as he is telling Full Story...HowЁЯШв,youtube have to ban this as he is telling full storyhow,youtube have to ban this as he is telling full storyhow
роХрогрпНроЯро┐рокрпНрокро╛ роирпА роОроЯрпБродрпНродро┐ропрпЗ роТро░рпБ рокроЯроорпН роЕрод ро╡ро┐роЯ роиро▓рпНро▓ро╛ родро╛ройрпН роЗро░рпБроХрпНроХрпБроорпНЁЯШВЁЯШВЁЯШВ,роХрогроЯрокрок рои роОроЯродродроп роТро░ рокроЯроо роЕрод ро╡роЯ роиро▓ро▓ родрой роЗро░роХроХроо,One of the most important things to do
ЁЯШВЁЯШВЁЯШВЁЯШВЁЯШВ,,
Idhellam oru padamada adhuku oru review adhu enakum vandhu tholayudhu,idhellam oru padamada adhuku oru review adhu enakum vandhu tholayudhu,qdam Oru Padadama Adhu Review adhu eeakum vanduku
Really really very fantastic review ЁЯШВЁЯШВ,really really very fantastic review,really really very fantastic review
I am Telugu and I would say its a one time watch in theatre. Not every region would have the same taste so I understand this review. As an example I did not like Salman khan&#39;s Dabaang because it was just a routine mass masala and no story but it was a super hit.,i am telugu and i would say its a one time watch in theatre not every region would have the same taste so i understand this review as an example i did not like salman khans dabaang because it was just a routine mass masala and no story but it was a super hit,i am telugu and i would say its a one time watch in theatre not every region would have the same taste so i understand this review as an example i did not like salman khans dabaang because it was just a routine mass masala and no story but it was a super hit
Bhagat basil suside panna scene waste,bhagat basil suside panna scene waste,bhagat basil suside panna scene waste
Puspa 2 semma movie really action..wife sentiment. Climax action ЁЯФе no one can do.,puspa semma movie really actionwife sentiment climax action no one can do,puspa semma movie really actionwife sentiment climax action no one can do
Dai movie story ye veetu perukaga thaan,dai movie story ye veetu perukaga thaan,Dai Movie Story Ye Veetu Perukaga Thaan
Maar maar ne atha,maar maar ne atha,Maarua Ne Athha
Goltis ЁЯШЕЁЯШЕ,goltis,gallery
ЁЯШВЁЯШВЁЯШВЁЯШВЁЯШВЁЯШВ,,
Review kuda epo la pakka mudiyala......<br>Apo padam ЁЯШоЁЯШоЁЯШоЁЯШоЁЯШоЁЯШо,review kuda epo la pakka mudiyalabrapo padam,Review horse epo la pakka mudiylabraprapat padam
роЪрпЖройрпНроЯро┐роорпЖройрпНроЯрпН роОройрпНройродрпНродрпБроХрпНроХрпБ ро╡роЪрпНроЪро┐ро░рпБроХрпНроХро╛ройрпНройрпБ роХрпЗроЯрпНроХро┐ро▒рпЗройрпН роЪрпЖройрпНроЯро┐роорпЖройрпНроЯрпН роЪрпАройрпН роХроЯрпНроЯро╛ропроорпН родрпЗро╡рпИ роорпБродро▓рпН рокроЯродрпНродро┐ро▓рпЗропрпЗ роЖро░роорпНрокро┐роХрпНроХро┐ро▒родрпБ роЗро▓рпНро▓ роЗроирпНрод роЪрпЖройрпНроЯро┐роорпЖройрпНроЯрпН роЪрпАройрпН роЕро╡ройрпЛроЯ роЕроЯрпИропро╛ро│родрпНродрпИ роХро╛роЯрпНроЯрпБро╡родро▒рпНроХро╛роХ ро╡рпЗрогрпНроЯро┐,роЪройроЯрооройроЯ роОройройродродроХроХ ро╡роЪроЪро░роХроХройрой роХроЯроХро▒рой роЪройроЯрооройроЯ роЪрой роХроЯроЯропроо родро╡ роородро▓ рокроЯродродро▓роп роЖро░роорокроХроХро▒род роЗро▓ро▓ роЗроирод роЪройроЯрооройроЯ роЪрой роЕро╡ройроЯ роЕроЯропро│родрод роХроЯроЯро╡родро▒роХроХ ро╡рогроЯ,"He is the owner of the company, which is not the only one who has been able to do this."
роиро╛ройрпН роЙройрпНройрпЛроЯ ро░ро┐роорпВро╡рпН рокро╛родрпНродрпБроЯрпНроЯрпБ роЗро░рпБроирпНродрпЗройрпН роиро╛ройрпН ро╡рпИродрпНродрпЖро░ро┐роЪрпНроЪро▓рпН рокрпЗроЪроХрпНроХрпВроЯро╛родрпБ ро╡ропро┐родрпНродрпЖро░ро┐роЪрпНроЪро▓ро┐ро▓рпН рокрпЗроЪро┐ роТро░рпБ роЗродрпБ роЗрокрпНрокроЯро┐ роХрпАро┤рпНродрпНродро░рооро╛рой ро╡рпЗро▓рпИроХро│рпН роЪрпЖропрпНропроХрпНроХрпВроЯро╛родрпБ,роирой роЙройройроЯ ро░рооро╡ рокродродроЯроЯ роЗро░роиродрой роирой ро╡родродро░роЪроЪро▓ рокроЪроХроХроЯрод ро╡ропродродро░роЪроЪро▓ро▓ рокроЪ роТро░ роЗрод роЗрокрокроЯ роХро┤родродро░роорой ро╡ро▓роХро│ роЪропропроХроХроЯрод,This is not the case with the age of the people of the country.
роОрокрпНрокроЯро╛ роУроЯрпБроорпН родрооро┐ро┤рпНроиро╛роЯрпНроЯро┐ро▓рпН роЙро│рпНро│ роироЯро┐роХро░рпНроХро│рпЛроЯ рокроЯроорпН роЕродрпБродро╛ройрпН роЕро░роЪро┐ропро▓рпНро╡ро╛родро┐роХро│рпН роЪрпБройрпНройро┐роп рокрпБроЯро┐роЪрпНроЪрпБ роКроорпНрокрпБро▒ро╛,роОрокрокроЯ роУроЯроо родрооро┤роироЯроЯро▓ роЙро│ро│ роироЯроХро░роХро│роЯ рокроЯроо роЕродродрой роЕро░роЪропро▓ро╡родроХро│ роЪройройроп рокроЯроЪроЪ роКроорокро▒,How to do it
роОрокрпНрокроЯро╛ роУроЯрпБроорпН родрооро┐ро┤рпНроиро╛роЯрпНроЯро┐ро▓рпН роЙро│рпНро│ роироЯро┐роХро░рпНроХро│рпЛроЯ рокроЯроорпН роЕродрпБродро╛ройрпН роЕро░роЪро┐ропро▓рпНро╡ро╛родро┐роХро│рпН роЪрпБройрпНройро┐роп рокрпБроЯро┐роЪрпНроЪрпБ роКроорпНрокрпБро▒ро╛,роОрокрокроЯ роУроЯроо родрооро┤роироЯроЯро▓ роЙро│ро│ роироЯроХро░роХро│роЯ рокроЯроо роЕродродрой роЕро░роЪропро▓ро╡родроХро│ роЪройройроп рокроЯроЪроЪ роКроорокро▒,How to do it
